Sheet: Control
A1: ID | B1: Actividad | C1: Inicio | D1: Fin | E1: Porcentaje Completado | F1: Depende de ID | G1: Responsable
B2: Inicio de Planeación | C2: 2015-07-14 | D2: 2016-07-31 | E2: 0.01
B3: Definición de responsables del congreso
B4: Determinar objetivos del congreso
B5: Determinar la audiencia meta
B6: Realizar el presupuesto
B7: Definir opciones de sede
B8: Definir opciones de recintos
B9: Investigar vias de comunicación que conectan con la sede
B10: Investigar capacidad hotelera
B11: Solicitar cotizaciones de las opciones de sede
B12: Solicitar cotizaciones de alimentos y bebidas
B13: Realizar primera revisión de avances
B14: Revisar y solicitar bases de datos actualizados de la audiencia meta y su costo (apoyandose ce cámaras y asociaciones)
B15: Definir un programa preliminar de actividades generales a realizar: conferencias, cenas, entre otros.
B16: A ocho meses del evento
B17: Determinar los comités que el responsable del evento va a coordinar: hospedaje, transportación aérea y terrestre, alimentos y bebidas, conferencistas/programa/contenido, promoción y publicidad
B18: Realizar viajes de inspección a las sedes preseleccionadas
B19: Revisar cotizaciones de recinto, hoteles, transportación, alimentos y bebidas
B20: Analizar viajes y cotizaciones
B21: Elección de sede y recinto
B22: Analizar contrato y reglamento de operación del recinto seleccionado
B23: Revisar la base de datos
B24: Diseñar el Manual del Expositor
B25: Definir la imagen general del evento (logo, papelería y el programa de producción)
B26: Diseñar la estrategia de mercadotecnia para el evento (correo electrónico, telemarketing, revistas especializadas, radio, televisión, presnsa, productos promocionales, etc.)
B27: Definir el plan de medios de promoción (calendarización)
B28: Call for papers
B29: Call for sponsors
B30: A seis meses del evento
B31: Negociación con hoteles, recinto y transportación
B32: Definición de la fecha del evento, así como tiempos de montaje y desmontaje
B33: Revisión del presupuesto
B34: Depuración de la base de datos
B35: Inicio de la promoción del evento (posters, invitaciones por correo electrónico, relaciones públicas, ruedas de prensa, etc.)
B36: Presentación del programa preliminar del evento de acuerdo a los conferenciastas confirmados
B37: Definir cómo se hará el preregistro (invitaciones y/o marketing)
B38: Eleborar el plan de transporte y hospedaje para los asistentes y sus acompañantes
B39: Establecer necesidades de equipo de apoyo: equipo audiovisual, decoración, atenciones, souvenirs, fotografía, filmación, grabación de videos y memorias del evento, iluminación, escengrafía, mamparas, tarimas, edecanes, traducción, módulos de recepción e información, sala de prensa y organizador, publicidad, traducción simultanea, transmisión de evento (radio, televisión, internet, podcast, videocast), imporesos, mensajería, mobiliario
B40: Invitación a ponentes extranjeros
B41: Deadline del call for papers
B42: A cuatro meses del evento
B43: Enviar correspondencia de promoción
B44: Impresión de programas definitivos
B45: Diseñar el programa turistico para acompañantes
B46: Primer cierre y monitoreo del preregistro
B47: Continua la depuración de la base de datos
B48: Redefinir necesidades y ajustes de presupuesto
B49: Lista preliminar de ponencias aceptadas
B50: A tres meses del evento
B51: Planeación del servicio de alimentos y bebidas (programar horarios)
B52: Confirmar la lista de equipo de apoyo y definir proveedores
B53: Ajustar necesidades de hotelería y transportación
B54: Continúa el preregistro y ajuste presupuesto
B55: Entrega Manual del Expositor
B56: A dos meses del evento
B57: Programación de eventos especiales (cena de gala, brindis, inauguración, etc.)
B58: Requerimientos adicionales: leyendas, mantas, señalización, gafetes, etc.
B59: Confirmar el tipo de montaje de las salas con el recinto
B60: Verificar avance de materiales e impresos
B61: Revisar el presupuesto actual y preregistro
B62: Revisar con proveedores tiempos de montaje y desmontaje de expositores
B63: Programa de conferencias y talleres
B64: Viáticos y apoyos para ponentes foráneos
B65: A un mes del evento
B66: Prueba y confirmación del menú/montajes/colores del mantel
B67: Confirmar habitaciones del hotel
B68: Confirmar transportación
B69: Revisar equipo de apoyo
B70: Preparar paquetes de información para participantes registrados
B71: Primera junta con el recinto par la revisión de la logística del evento
B72: Labor de marketing para quienes no se han registrado
B73: Cerrar el contrato con alimentos y bebidas y pagar el anticipo
B74: A una semana del evento
B75: Cerrar cuentas con alimentos y bebidas
B76: Junta final para revisión de la logística con el recinto; horarios y fechas de montaje y desmontaje, vigilancia, limpieza, requisitos de teléfonos y faxes, servicios de copiado, apoyo en escenografía, señalización, estacionamiento, ubicación del área de registro, requerimientos para la inauguración, área de invitados especiales, preveedores oficiales, etc.
B77: Junta con alimentos y bebidas para revisar horarios y tiempos
B78: Junta con hoteles, confirmar últimos detalles
B79: Junta con empresa de transportación
B80: Confirmación de programa de acompañantes
B81: Después del evento
B82: Listas de correo por temas de interés
B83: Recopilación de fotos y videos del evento
B84: Pasear a los ponentes que se quedan unos días más
B85: Seguimiento de compromisos de ponentes invitados
B86: Publicación en la nube de videos de las ponencias
B87: Publicación en la nube de materiales de las ponencias
B88: Comité organizador del siguiente CONSOL

Sheet: Reunion_22_Viandas
A1: Llevador | B1: Lleva | D1: Pendiente Asignar
A2: Raul Gómez | B2: CARNE | D2: Refrescos | F2: Raul Gomez
A3: Jorge Díaz | D3: Vasos de plastico refresco | F3: Día 22 de agosto
A4: Hector Leal Morales | D4: Vasos unicel | F4: Canarias 601
A5: Edward Castillo | D5: Servilletas | F5: Col portales
A6: Luis David Jonathan Vargas Pastrana | D6: Limones | F6: México DF 03300
A7: Alexis Tapia | D7: Chorizo | F7: Esquina emperadores
A8: Jose Luis | D8: Queso asadero
A9: Max de Mendizabal | D9: Nopales
A10: Sandino Araico Sánchez | D10: Café
A11: Gunnar Wolf | D11: Azucar
A12: Fernando Romo | D12: Cerveza
A13: Roberto Andrade | D13: Papas
A14: Alejandro Sánchez Martínez | D14: Chetos
A15: Claudia Landa | D15: Cerveza
A16: Octavio Ruiz | D16: Papel Palfun
A17: Manuel Rebade | D17: Garrafón de agua
A18: César Yáñez Fernández | D18: Bolsas para basura
A19: Enrique Martínez Roldán | D19: Cerveza
A20: Emilio Saldaña | D20: Mas cerveza
A21: Ivan Martinez | D21: Por si se nos olvida CERVEZA
A22: Odín Mojica | D22: Hielos
A23: Omar sansi | D23: Pastel
A24: José Luis Chiquete Valdivieso | D24: Cerveza
A25: Alan Lazalde | D25: Tortillas
A26: Georgina Pérez y bebe | D26: tequila
A27: Irene Soria | D27: Mezcal
A28: Octavio A. Méndez Sanchez
A29: Virgilio Pérez
A30: Iván Chavero
A31: Abiel Tomás Parra Hernández | D31: Más Cerveza
A32: Claudia Hernández
A33: Alejandro Lopez
A34: Alejandro Arellano
A35: Andrei Altamirano | D35: Beer

Sheet: Agenda_Sabado-22
A1: ID | B1: Tema
B2: Llegada de comensales consoleros
B3: Saludos abrazos y arrimón a Odin
B4: Comida
B5: Recuento Historia Consol
B6: Objetivos CONSOL 2016
B7: Definición de Sede
B8: Patrocinadores
B9: Participacion del poder legislativo, ejecutivo o judicial
B10: Cerveza
B11: y mas Cerveza

Sheet: Objetivos
A1: ID | B1: Objetivo
A2: 1 | B2: Reencontrar a la comunidad de software libre en México
A3: 2 | B3: Compartir soluciones para diversos sectores mediante talleres de hasta 24 horas, donde aprendas algo realmente (no que te digan que son bien chingones).
A4: 3 | B4: Involucrar a nuevas generaciones en la organización del CONSOL
A5: 4 | B5: Dotar a la Asociación CONSOL, A.C. los insumos para el desarrollo del Congreso Nacional de Software Libre
A6: 5 | B6: Crear un Directorio de empresas de Software Libre

Sheet: Ejes Temáticos
A1: ID | B1: Temática
A2: 1 | B2: Desarrollo de Software
A3: 2 | B3: Diseño Gráfico
A4: 3 | B4: Tecnología en el arte y la educación
A5: 4 | B5: Software Libre
A6: 5 | B6: Hardware Libre
A7: 6 | B7: Energías Libres
A8: 7 | B8: Música con Creative Commons
A9: 8 | B9: Internet de las cosas
A10: 9 | B10: Derechos Digitales
A11: 10 | B11: Seguridad en Cómputo e Informática
A12: 11 | B12: Redes
A13: 12 | B13: Voz sobre IP
A14: 13 | B14: Filosofía
A15: 14 | B15: Negocios
A16: 15 | B16: Casos de Éxito
A17: 16 | B17: Conferencias
A18: 17 | B18: Talleres
A19: 18 | B19: Pláticas Técnicas
A20: 19 | B20: Pláticas Informales
A21: 20 | B21: Tutoriales
A22: 21 | B22: Presentación de Proyectos
A23: 22 | B23: Exposición de Soluciones
A24: 23 | B24: Mesas Redondas

Sheet: Programa
C1: Conferencias 1 | D1: Conferencias 2 | E1: Conferencias 3 | F1: Taller 1 40 P | G1: Taller 2 40 P | H1: Taller 3 | I1: Taller 4 | K1: Conferencias | L1: Talleres
A2: DIA MONTAJE
A6: DIA 1
A7: 8:00 | B7: 9:00 | C7: Registro
A8: 9:00 | B8: 9:45 | C8: Inauguración
A9: 10:00 | B9: 11:00 | C9: Conferencia Magistral | K9: 1
A10: 11:00 | B10: 12:00 | K10: 3
A11: 12:00 | B11: 13:00 | K11: 3
A12: 13:00 | B12: 14:00 | K12: 3
A13: 14:00 | B13: 16:00 | C13: Comida
A14: 16:00 | B14: 17:00 | K14: 3
A15: 17:00 | B15: 18:00 | K15: 3
A16: 18:00 | B16: 19:00 | K16: 3
A17: 19:00 | B17: 20:00
A18: 20:00 | B18: 21:00 | C18: Brindis de inauguración
A19: 21:00 | B19: 22:00
A20: 22:00 | B20: 0:00
A21: DIA 2
A22: 8:00 | B22: 9:00
A23: 9:00 | B23: 9:45
A24: 10:00 | B24: 11:00 | K24: 3
A25: 11:00 | B25: 12:00 | K25: 3
A26: 12:00 | B26: 13:00 | K26: 3
A27: 13:00 | B27: 14:00 | C27: Conferencia Magistral | K27: 1
A28: 14:00 | B28: 16:00 | C28: Comida
A29: 16:00 | B29: 17:00 | K29: 3
A30: 17:00 | B30: 18:00 | K30: 3
A31: 18:00 | B31: 19:00 | K31: 3
A32: 19:00 | B32: 20:00
A33: 20:00 | B33: 21:00 | C33: Cena de convivencia
A34: 21:00 | B34: 22:00
A35: 22:00 | B35: 0:00
A36: DIA 3
A37: 8:00 | B37: 9:00
A38: 9:00 | B38: 9:45
A39: 10:00 | B39: 11:00 | K39: 3
A40: 11:00 | B40: 12:00 | K40: 3
A41: 12:00 | B41: 13:00 | K41: 3
A42: 13:00 | B42: 14:00 | C42: Conferencia Magistral | K42: 1
A43: 14:00 | B43: 16:00
A44: 16:00 | B44: 17:00 | K44: 3
A45: 17:00 | B45: 18:00 | K45: 3
A46: 18:00 | B46: 19:00 | K46: 3
A47: 19:00 | B47: 20:00
A48: 20:00 | B48: 21:00
A49: 21:00 | B49: 22:00
A50: 22:00 | B50: 0:00
A51: DIA 4
A52: 8:00 | B52: 9:00
A53: 9:00 | B53: 9:45
A54: 10:00 | B54: 11:00 | K54: 3
A55: 11:00 | B55: 12:00 | K55: 3
A56: 12:00 | B56: 13:00 | K56: 3
A57: 13:00 | B57: 14:00 | C57: Clausura del Evento | K57: 1
A58: 14:00 | B58: 15:00
A59: 15:00 | B59: 16:00
A60: 16:00 | B60: 17:00
A61: 17:00 | B61: 18:00
A62: 18:00 | B62: 19:00
A63: 19:00 | B63: 20:00 | C63: Fiesta de Clausura
A64: 20:00 | B64: 21:00
A65: 21:00 | B65: 22:00
A66: 22:00 | B66: 0:00
A67: DIA Extra
A68: 8:00 | B68: 9:00
A69: 9:00 | B69: 9:45
A70: 10:00 | B70: 11:00 | C70: Cura Cruda
A71: 11:00 | B71: 12:00
A72: 12:00 | B72: 13:00
A74: TOTALES | K74: of:=SUM([.K9:.K67]) -> 67

Sheet: Comité Organizador
A1: Nombre | B1: Nick | C1: Responsabilidad | D1: Correo Electrónico | E1: Móvi
A2: Raul Gómez | B2: Raul | C2: Comunicaciones Oficiales | D2: raul.gomez.mexico@gmail.com | E2: 5555037307
A3: Jorge Díaz | B3: Little_Bear | C3: Coordinación 2016 | D3: jorge.diaz@gmail.com | E3: 55 36620240
A4: Hector Leal Morales | B4: Etosh | C4: Coordinación 2016 | D4: hlealm@gmail.com | E4: 55 13848796
A5: Edward Castillo | B5: Punk0 | C5: Coordinación Redes | D5: edwardrcastillo@gmail.com | E5: 9841579869
A6: Luis David Jonathan Vargas Pastrana | B6: Leprechaun | C6: Coordinación Infraestructura | D6: leprechaun@nixandbeer.com | E6: 55 39540461
A7: Alexis Tapia | B7: Alexis | C7: Coordinación Representantes y Voluntarios | D7: ealexis.t@gmail.com | E7: 924 126 1674
A8: Jose Luis Hernández | B8: Simbiotico | C8: Coordinación Historia Consol | D8: jhdz@simbiotica.net | E8: 5525634459
A9: Sandino Araico Sánchez | B9: KBrown | C9: Comité Infraestructura / Coordinador Web | D9: sandino@1101.mx | E9: 55 21295730
A10: Max de Mendizabal | B10: Negrabarba | C10: Comité Académico Coordinador | D10: max.de.mendizabal@gmail.com | E10: 5527553623
A11: Gunnar Wolf | B11: Gwolf | C11: Comite Académico | D11: gwolf@gwolf.org | E11: 55 1451 2244
A12: Fernando Romo | B12: Pop | C12: Comite Académico | D12: fernando.romo@gmail.com
A13: Roberto Andrade | B13: Dalton | C13: Comite Académico | D13: randradefonseca@gmail.com
A14: Alejandro Sánchez Martínez | B14: Lurkan | C14: Comite Académico | D14: lurkan@gmail.com | E14: 5554063306
A15: Claudia Landa | B15: Cloe | C15: Comite Académico | D15: claudia.landa.r@gmail.com | E15: 55 34557028
A16: Octavio Ruiz | B16: Tacvbo | C16: Comite Académico | D16: tacvbo@tacvbo.net
A17: Manuel Rebade | B17: MiG | C17: Comite Académico | D17: manuel@rabade.net | E17: 5545336108
A18: César Yáñez Fernández | B18: Hokum | C18: Comite Académico | D18: cesar@cyanezfdz.me | E18: 55 4184 6062
A19: Enrique Martínez Roldán | B19: Enrique | C19: Comite Académico | D19: enrique@e-roldan.net | E19: 55 2888 2898
A20: Emilio Saldaña | B20: Pizu | C20: Comite Académico | E20: 55 44841730
A21: Ivan Martinez | B21: Protoplasmakid | C21: Comite Académico | D21: galaver@gmail.com | E21: 55 4944 6374
A22: Manuel Haro | B22: Haro | C22: Comité Académico | D22: manuel.haro@zacatecas.gob.mx | E22: 492 1341789 | F22: Laboratorio de Software Libre de Zacatecas
A23: Antonio Galicia | B23: Galicia | C23: Comité Académico | D23: antonio.galicia@gmail.com | E23: 55 40930645
A24: Odín Mojica | B24: Odin | C24: Comité Comunicación | D24: odinmojica@gmail.com | E24: 55 4011 5699
A25: Alan Lazalde | B25: Alan | C25: Comité Comunicación | D25: gustavo.lazalde@gmail.com | E25: 55 29413003
A26: Victor Martinez | B26: Victim | C26: Comité Comunicación | D26: victor.m3@gmail.com | E26: 55 20728961
A27: Omar sansi | B27: Sansi | C27: Comunidades
A28: José Luis Chiquete Valdivieso | B28: Josech | C28: Algo hará (Troll) | D28: josech@gmail.com | E28: 5543907327
A29: Irene Soria | B29: Arenitasoria | C29: Comité Diseño Coordinación | D29: idem24@gmail.com | E29: 55 27314914
A30: Chema Serralde | B30: Sonohacker | C30: Comite Diseño
A31: Claudia Hernández | B31: Casyopea | C31: Comité Diseño | D31: casyopea@g-blender.org
A32: Octavio A. Méndez Sanchez | B32: Octagesimal | C32: Comité Diseño | D32: octavio@cursosblender.com | E32: 473 7349090
A33: Georgina Pérez | B33: xepix | C33: Comité Logistica | D33: xepix.schnaider@gmail.com | E33: 33 12422678
A34: Gerardo Díaz | C34: Representante en Aguascalientes | D34: gerardo.diaz@theinventorhouse.org | E34: 4492094476
A35: Virgilio Pérez | C35: Representante en Baja California | D35: chendo3865@gmail.com | E35: 6641987801
C36: Representante en Baja California Sur
C37: Representante en Campeche
C38: Representante en Coahuila de Zaragoza
C39: Representante en Colima
C40: Representante en Chiapas
A41: Iván Chavero | B41: imcsk8 | C41: Representante en Chihuahua | D41: ichavero@gmail.com | E41: 614 142 1775
A42: Abiel Tomás Parra Hernández | B42: QuarryCero | C42: Representante en Distrito Federal | D42: abiel.parra@darsis.com.mx | F42: Instituto Tecnológico de Iztapalapa
C43: Representante en Durango
C44: Representante en Guanajuato
C45: Representante en Guerrero
C46: Representante en Hidalgo
A47: Alejandro Lopez | C47: Representante en Jalisco | D47: alxgdl@gmail.com | E47: 33 38142056 | F47: Universidad de Guadalajara - CUCEA
A48: Alejandro Arellano | C48: Representante en el Estado de México | D48: alejarellator@gmail.com | E48: 722 474 3484 | F48: Instituto Tecnológico de Toluca
C49: Representante en Michoacán
C50: Representante en Morelos
C51: Representante en Nayarit
C52: Representante en Nuevo León
A53: Esponjas de Tuxtepec | C53: Representante en Oaxaca
A54: Drupal | C54: Representante en Puebla
C55: Representante en Querétaro
C56: Representante en Quintana Roo
C57: Representante en San Luis Potosí
C58: Representante en Sinaloa
C59: Representante en Sonora
C60: Representante en Tabasco
A61: José Hernandez | C61: Representante en Tamaulipas | D61: jchm.itcm.isc@hotmail.com | E61: 448331688740 | F61: Insituto Tecnológico de Cd. Madero.
C62: Representante en Tlaxcala
A63: Victor Mejía | B63: Darkwolf | C63: Representación en Veracruz | D63: vmejialara@gmail.com | E63: 229 279 5170 | F63: Universidad del Centro de Veracruz
C64: Representación en Yucatán
C65: Representación en Zacatecas
A66: Andrei Altamirano | B66: rastux | C66: Desarrollo App de Consol y/o Voluntariado
A67: Hugo Miguel Gallardo | C67: Desarrollo App de Consol

Sheet: Ponentes a Invitar
A1: Nombre | B1: Nick | C1: Tema | D1: Universisdad/Empres | E1: País Residencia | F1: Ciudad Residencia | G1: Correo electrónico | H1: Móvil | I1: Fijo | J1: Observaciones
A2: Alán Aspuru-Guzik | B2: Nopal | C2: Computo Científico | D2: Harvard University | E2: EUA | F2: Massachusetts | G2: alan@aspuru.com | I2: (617) 384-8188 | J2: NopalBBS
A3: Alejandro Díaz Infante | B3: Astroboy | C3: SL en la Educación Básica | D3: SEP Zacatecas | E3: México | F3: Zacatecas | G3: adiaz@formacioncontinuazac.gob.mx | J3: Distribución Linux Educativa en Zacatecas / Libro de 5 de primaria con SL
A4: Alvaro López Ortega | B4: Alo BBS | C4: Openstack | D4: Red Hat | E4: EUA
A5: Robin Miller | B5: Roblimo | C5: Slashdot | D5: Slashdot | E5: EUA
A6: Bdale Garbee | D6: HP | E6: EUA
A7: Mitchel Baker | C7: Libertades y Software Libre | D7: Mozilla | E7: EUA
A8: Martin Dougiamas | C8: Moodle | D8: Moodle | E8: Australia | G8: martin@moodle.com
A9: Linus Trovalds | C9: Programación de sistemas operativos | D9: Linux | E9: EUA
A10: Adrian de los Santos | B10: Demon | D10: SICTUM | E10: México
A11: Enrique Sánchez | B11: Nahual | C11: Programación segura | D11: Yaguarete Sec | E11: EUA | G11: nahualito@gmail.com
A12: Gustavo Barrón Mijares | B12: Cicloid | C12: Curvatura del espacio-tiempo y los clcloidminutos | D12: Silicon Valley y el Software Libre | E12: EUA | G12: cicloid@gmail.com
A13: Basilio Briseño | B13: bbh | E13: EUA
A14: Federico Mena | B14: Quartic | E14: México | F14: Veracruz
A15: Arturo Espinosa | B15: Pupilo | E15: México | F15: D.F. | H15: 55 3222 6064
A16: Sandino Flores | B16: Tigrux | C16: Debugueando con los Grandes | D16: Intel | E16: México | F16: Tlajomulco
A17: Miguel Barajas | B17: GNUOwned | C17: Cloud | D17: CISCO | E17: México | F17: Metepec | G17: gnuowned@gmail.com
A18: Richard Couture | C18: Programación en C / Netfilter | D18: Linux Cabal | E18: México | F18: Guadalajara
A19: Katitza Rodriguez | B19: Katitza | C19: Privacidad y Vigilancia | D19: EFF | E19: USA | F19: San Francisco, Ca. | G19: katitza@eff.org | H19: 1 202 355 5901
A20: Ivan Martinez | C20: Wikimedia México | E20: México | F20: D.F. | G20: galaver@gmail.com | I20: 55 4944 6374
A21: Alejandro Miranda | B21: P00k4 | C21: Rebelde Educativo con estadísticas
A22: Ricardo Fritsch | B22: Fritsch | C22: FLSL | D22: Asociación Software Livre | E22: Brasil | F22: Porto Alegre-RS | G22: ricardo@softwarelivre.org | H22: 55 51 8213 5995
A23: Francisco Javier Castellón Fonseca | B23: CastellonNay | C23: marco legal mexicano y el software libre | D23: Grilla política | E23: México | F23: Nayarit
A24: Salvador Ortiz | C24: Programación en Perl | D24: MSG | E24: México | F24: DF | G24: sog@msg.com.mx
A25: Aldair Salcedo | B25: Aldair | C25: Xamarin / Mono | H25: 52 1 81 8273 6259
A26: Theo de Raadt | B26: Theo | C26: OpenSSH | D26: OpenBSD | E26: Canadá | G26: deraadt@theos.com
A27: Ingo Molnar | C27: programación del kernel | E27: Hungría
A28: Andrew Tanenbaum | C28: Programación de sistemas operativos | E28: Holanda | F28: Amsterdam
A29: Javier Diaz | C29: Drones | E29: México | F29: D.F.
A30: Iddar Olivares | E30: México
A31: Addiel Juarez
A32: Ivan Martinez Arce | C32: Programacion en Bash | E32: Mexico | F32: Mordor
A33: Erick Cardona | C33: OpenStack | E33: México | F33: San Luis Potosi
A34: Hector Mendez Lopez | C34: Hardware Libre | E34: México | F34: San Luis Potosi | G34: hector.a.mebdez.l@gmail.com | H34: 4442853521
A35: Lucero Castañeda Calvillo | C35: Android | D35: UAZ | E35: México | F35: Zacatecas | G35: lecc.14@hotmail.com | H35: 4921291469
A36: Joyce Lozano Aguilar | C36: Android | D36: UAZ | E36: México | F36: Zacatecas
A37: David De Santiago Salazar | C37: desarrollo web | E37: México | F37: Zacatecas
A38: Eder Morales Nieto | C38: OpenERP | D38: Presidencia Guadalupe | E38: México | F38: Zacatecas
A39: Fausto Fernandez Hernandez | C39: node js | E39: México | F39: Guadalajara
A40: Angel Martin Alejandro Santiago | E40: México | F40: Veracruz
A41: Ana Karen Camacho | C41: Maker | E41: México | F41: DF | G41: akaren.camacho.g@gmail.com | H41: 7775635751
A42: Diana Carolina Carrel Martinez | C42: Blender | E42: México | F42: Veracruz | G42: dianac2010@gmail.com
A43: José Martin Gamboa | B43: Montesillo | C43: Colaborador en el instalador de Ubuntu / Geolocalización | D43: Ubuntu | E43: México | F43: Zacatecas | G43: martinsillo.gamboa@gmail.com / martin.gamboa@webzac.net | H43: (492)1401481
A44: Michel Nogales | C44: Desarrollo de aplicaciones hibridas | D44: Presidencia Guadalupe | E44: México | F44: Oaxaca | G44: michelnogales@gmail.com | H44: 492 162 8120
A45: Oscar | C45: Desarrollo de aplicaciones hibridas | D45: Presidencia Guadalupe | E45: México | F45: Oaxaca | G45: arkam_libre@hotmail.com | H45: 9581118735
A46: Lemog | E46: México | F46: Toluca | G46: l3m0g@hotmail.com | H46: 7226207848
A47: Miguel Hernadez | C47: Juegos en 3D | D47: UTEZ | E47: México | F47: San luis Potosi | G47: mhernandez.tics@gmail.com | H47: 4961192974
A48: Angel lopez | C48: Telemetría | E48: México | F48: Veracruz
A49: Rolman
A50: Rootsan

Sheet: Patrocinadores
A1: Nombre | B1: Tipo de Patrocinio | C1: Bien o Servicio | D1: Nombre Contacto | E1: Correo
A2: 1101 | B2: Especie | C2: Todologo Web :) | D2: Sandino Araico | E2: sandino@sandino.net | F2: 55 1419 3132
A3: Red Hat | B3: Especie | C3: Ponente Taller | D3: Karewytt González | E3: kagonzal@redhat.com | F3: 04455 4443 5519
A4: Red Hat | B4: Especie | C4: Ponente Taller | D4: Julieta Sanchez | E4: jsanchez@redhat.com
A5: Suse | B5: Especie | C5: Ponente Taller
A6: The Linux Foundation | B6: Especie
A7: Software Gurú | B7: Especie | C7: Difusión
A8: Corona | B8: Especie | C8: Cerveza
A9: Conacyt | B9: Especie | C9: Recinto / Becas | G9: http://www.conacyt.mx/index.php/cai
A10: Rackspace | B10: Especie | C10: Ponente Taller | D10: Vanesa Colin | E10: vane.colin@rackspace.com | F10: 55 4193 2899
A11: Rackspace | B11: Especie | C11: Ponente Taller | D11: David García Hernández | E11: david.garcia2@rackspace.com | F11: 52 (155) 2027 2530
A12: CUCEA | B12: Alejandro López | C12: Becas y ponente | D12: Universidad de Guadalajara - CUCEA | E12: alex alxgdl@gmail.com | F12: 33 3814 2056
A13: LABSOL | B13: Manuel Haro | C13: Becas y ponente | E13: manuel.haro@zacatecas.gob.mx | F13: 492 1341789
A14: Mozilla México | B14: Difusión / SWAG / Ponentes
A15: Wikimedia México | B15: Difusion / Ponente Taller / Ponente Conferencia | D15: Ivan Martinez | E15: galaver@gmail.com | F15: 55 4944 6374
A16: Microsoft Openess | B16: Económico / Servicios / Taller | D16: Claudio Morales | E16: claudio.morales.g@gmail.com | F16: 55 2729 0516
A17: Amazon | D17: Ricardo Rentería Pilar Mercado | E17: rrrenter@amazon.com
A18: Infotec
A19: AMITI | D19: Heidy Obregón | E19: hobregon@amiti.org.mx | F19: 52 55 52070409 X 105
A20: AMIPCI
A21: CANIETI
A22: CISCO
A23: HP
A24: IBM
A25: Intel
A26: Electronic Frontier Foundation
A27: AMESOL
A28: Red Bull
A29: Café Punta del Cielo
A30: Café Cielito Querido
A31: Café Garat
A32: Café Ilegal
A33: Ambulancia
A34: Comisión Federal de Electricidad | B34: Raúl Gomez
A35: Mexico First

Sheet: Sedes_Posibles
A1: SIGLAS | B1: Nombre | C1: Campus | D1: Ventajas | E1: Desventajas
A2: UNAM | B2: Universidad Nacional Autónoma de México | C2: Ingeniería | D2: Se han desarrollado ediciones anteriores.
A3: UDG | B3: Universidad de Guadalajara | C3: CUCEA | D3: Institucón comprometida con la cultura y filosofía del Software Libre, cuenta con recursos y espacios para apoyar el evento. En Jalisco se han llevado los eventos de tecnología relevantes en los últimos años, y el CUCEA ha realizado varios de ellos, dando mucho apoyo a los eventos.
A4: IPN | B4: Instituto Politécnico Nacional | C4: Queso | D4: Se han desarrollado ediciones anteriores.
A5: Oaxtepec | B5: Centro vacacional oaxtepec | D5: Todo en un mismo espacio | E5: Todo tiene un costo monetario
A6: UACM | B6: Universidad de la Ciudad de México | C6: San Lorenzo Tezonco

Sheet: Requerimientos_Sede
A1: Requerimiento
A2: Espacio para conferencia inauguración, clausura y conferencias magistrales para 500 personas.
A3: Espacios para XX conferencias simultaneas
A4: Espacio para XX talleres
A5: Servicio de Internet
A6: Permiso para instalar comedor.
A7: Permiso para introducir cerveza.

Sheet: Difusión
A1: Medio | B1: Descripción
A2: Blogs/Sitiios Web | B2: Artículos relacionados al Congreso o haciendo mención al mismo
A3: Banners | B3: Publicar en sitios web simpatizantes y de patrocinadores
A4: Facebook | B4: Utilizar la red social para tener contacto por esta vía.
A5: Twitter | B5: Utilizar la red social para tener contacto por esta vía.
A6: Poster | B6: Se imprimirán y enviarán con los representantes para que sean pegados en instituciones educativas y sitios de interés.
A7: Radio | B7: Se buscarán espacios en estos medios
A8: Televisión | B8: Se buscarán espacios en estos medios
A9: Medios Impresos | B9: Se buscarán espacios en estos medios

Sheet: Presupuesto
A1: Nombre | B1: Cantidad | C1: Costo por unidad | D1: Costo Total por Día | E1: Total Días | F1: Costo Sin IVA | G1: Costo c/IVA | H1: Financiamiento | I1: Confirmado
A3: Cabaña para 5 miembros del Staff | B3: 8 | C3: 1570 | D3: of:=[.C3]*[.B3] -> 12560 | E3: 5 | F3: of:=[.E3]*[.D3] -> 62800 | G3: of:=[.F3]*1.16 -> 72848
A4: Habitación doble para ponente por noche | B4: 67
A5: Hospedaje Voluntarios | B5: 30
A6: Habitación para Representantes por día - Hotel Familiar p/6 personas | B6: 6 | C6: 875 | D6: of:=[.C6]*[.B6] -> 5250 | E6: 5 | F6: of:=[.E6]*[.D6] -> 26250 | G6: of:=[.F6]*1.16 -> 30450
A7: Transportación Staff - DF - Oaxtepec | B7: 30 | C7: 150 | D7: of:=[.C7]*[.B7] -> 4500 | E7: 2 | F7: of:=[.E7]*[.D7] -> 9000 | G7: of:=[.F7]*1.16 -> 10440
A8: Transportación Ponentes - DF - Oaxtepec | B8: 67 | C8: 150 | D8: of:=[.C8]*[.B8] -> 10050 | E8: 2 | F8: of:=[.E8]*[.D8] -> 20100 | G8: of:=[.F8]*1.16 -> 23316
A9: Transportación Voluntarios | B9: 30 | C9: 150 | D9: of:=[.C9]*[.B9] -> 4500 | E9: 2 | F9: of:=[.E9]*[.D9] -> 9000 | G9: of:=[.F9]*1.16 -> 10440
A10: Transportación Representantes | B10: 32 | C10: 150 | D10: of:=[.C10]*[.B10] -> 4800 | E10: 2 | F10: of:=[.E10]*[.D10] -> 9600 | G10: of:=[.F10]*1.16 -> 11136
A11: Salas para 40 personas para talleres - costo por 9 Horas | B11: 4 | C11: of:=2630+(280*8) -> 4870 | D11: of:=[.C11]*[.B11] -> 19480 | E11: 5 | F11: of:=[.E11]*[.D11] -> 97400 | G11: of:=[.F11]*1.16 -> 112984
A12: Auditorio para 500 personas para conferencias magistrales, inauguración y cierre. | B12: 7 | C12: 7850 | D12: of:=[.C12]*[.B12] -> 54950 | E12: 1 | F12: of:=[.E12]*[.D12] -> 54950 | G12: of:=[.F12]*1.16 -> 63742
A13: Alojamiento Web | B13: 1 | H13: Patrocinador
A14: Banners | B14: 25
A15: Lonas | B15: 10
A16: Reconocimientos | B16: 600
A17: Tazas | B17: 150 | C17: 36 | D17: of:=[.C17]*[.B17] -> 5400 | E17: 1 | F17: of:=[.D17]*[.E17] -> 5400 | G17: of:=[.F17]*1.16 -> 6264
A18: Mochila | B18: 600
A19: Libreta | B19: 600
A20: Pluma | B20: 600
A21: Folders | B21: 600
A22: Cordón para portagafete | B22: 600
A23: Portagafete | B23: 600
A24: Comida Dia Montaje | B24: 100 | C24: 220 | D24: of:=[.C24]*[.B24] -> 22000 | E24: 1 | F24: of:=[.E24]*[.D24] -> 22000 | G24: of:=[.F24]*1.16 -> 25520
A25: Cena Día Montaje | B25: 100 | C25: 220 | D25: of:=[.C25]*[.B25] -> 22000 | E25: 1 | F25: of:=[.E25]*[.D25] -> 22000 | G25: of:=[.F25]*1.16 -> 25520
A26: Desayuno Día Evento | B26: 100 | C26: 220 | D26: of:=[.C26]*[.B26] -> 22000 | E26: 4 | F26: of:=[.E26]*[.D26] -> 88000 | G26: of:=[.F26]*1.16 -> 102080
A27: Comida Dia Evento | B27: 500 | C27: 220 | D27: of:=[.C27]*[.B27] -> 110000 | E27: 4 | F27: of:=[.E27]*[.D27] -> 440000 | G27: of:=[.F27]*1.16 -> 510400
A28: Cena Día Evento | B28: 500 | C28: 220 | D28: of:=[.C28]*[.B28] -> 110000 | E28: 4 | F28: of:=[.E28]*[.D28] -> 440000 | G28: of:=[.F28]*1.16 -> 510400
A29: Desayuno Día Extra | B29: 100 | C29: 220 | D29: of:=[.C29]*[.B29] -> 22000 | E29: 1 | F29: of:=[.E29]*[.D29] -> 22000 | G29: of:=[.F29]*1.16 -> 25520
A34: Totales | G34: of:=SUM([.G2:.G33]) -> 1541060
A35: * Costos en base a la pagina del IMSS Oaxtepec

Sheet: Financiamiento
A1: ID | B1: Descripción | C1: Cantidad | D1: Costo por Unidad | E1: Total
A2: 2 | B2: Becas Estudiantes | C2: 100 | D2: of:=[.D4] -> 5500 | E2: of:=[.D2]*[.C2] -> 550000
A3: 3 | B3: Presupuesto | C3: 1 | D3: of:=[Presupuesto.G34] -> 1541060 | E3: of:=[.D3]*[.C3] -> 1541060
A4: 4 | B4: Boleto de asistencia | C4: 300 | D4: 5500 | E4: of:=[.D4]*[.C4] -> 1650000
E5: of:=[.E4]-[.E3] -> 108940

Sheet: Voluntarios
A1: Nombre | B1: Nick | C1: Area de Apoyo | D1: Correo Electrónico | E1: Móvi
A4: Depende de la selección de la sede.

Sheet: Welcome Pack
B1: Contenido | C1: Descripción | D1: Cantidad | E1: Costo | F1: Proveedor
A2: Asistentes | B2: USB | D2: 600
A3: Asistentes | B3: Libreta | D3: 600
A4: Asistentes | B4: Pluma | D4: 600
A5: Asistentes | B5: Playera Asistente | D5: 550
A6: Asistentes | B6: Mochila | D6: 550
A7: Staff/Ponentes | B7: Taza | D7: 67
A8: Asistentes | B8: Diploma de Asistencia | D8: 600
A9: Ponentes | B9: Reconocimiento Ponente | D9: 67
A10: Ponentes Talleres | B10: Apuntador Laser | D10: 0
A11: Ponentes | B11: Arduino | D11: 67

Sheet: Reuniones_Externas
A1: Fecha | B1: Entidad o Persona | C1: Asistentes Comité Organizador | D1: Asistentes Entidad | E1: Asunto | F1: Acuerdos | G1: Siguiente Reunión | H1: Obaservaciones
A2: 2015-07-16 | B2: Red Hat México | C2: Jorge Díaz / Héctor Leal | D2: Miguel Rascón / Chicas MKT | E2: Acercamiento Patrocinio
B3: Suse México | D3: Andrés Mendez | E3: Acercamiento Patrocinio